{
  "compiler": {
    "deterministic": true,
    "name": "viralyst-script-intelligence-compiler",
    "network_access": false,
    "semantic_analyzer_version": "local-rules-1.0.0",
    "version": "1.0.0"
  },
  "content": {
    "clean_transcript": {
      "confidence": 0.9183,
      "evidence_type": "observed",
      "method": "extractor_ASR_with_mean_word_confidence",
      "sources": [
        {
          "path": "$.transcript.full_text"
        }
      ],
      "value": "Let's talk about the richest man in the world, shall we? I gather you're not on the Earth. Well, I gather You're not on his Christmas card list anymore Okay, so I agree with him on various things. I agree with him on the existential threat for example he takes it seriously and he's done some good things like electric cars and communications for people in Ukraine using Starlink, so he's definitely done some good things but But what he's doing now with Doge is obscene. What's happening is he's cutting almost at random, lots of government workers. So good, honest people who go to work and do their job. He's accusing them of being corrupt and lazy and useless and just cutting their jobs. And it's gonna be terrible. It's gonna have terrible consequences on people. And he just doesn't seem to care. So the one thing, the only time I've seen him care was when I criticized him and he said I was cruel."
    },
    "content_format": {
      "evidence_type": "unknown",
      "reason": "speaker diarization and source format metadata are unavailable",
      "sources": [],
      "value": null
    },
    "estimated_audience_intent": {
      "evidence_type": "unknown",
      "reason": "audience intent is not observed in the extractor report",
      "sources": [],
      "value": null
    },
    "language": {
      "confidence": 1.0,
      "evidence_type": "observed",
      "sources": [
        {
          "path": "$.transcript.language"
        }
      ],
      "value": "en"
    },
    "normalized_transcript": {
      "confidence": 1.0,
      "evidence_type": "deterministic_derivation",
      "method": "NFKC_whitespace_lowercase_word_normalization_v1",
      "sources": [
        {
          "path": "$.transcript.full_text"
        }
      ],
      "value": "let's talk about the richest man in the world shall we i gather you're not on the earth well i gather you're not on his christmas card list anymore okay so i agree with him on various things i agree with him on the existential threat for example he takes it seriously and he's done some good things like electric cars and communications for people in ukraine using starlink so he's definitely done some good things but but what he's doing now with doge is obscene what's happening is he's cutting almost at random lots of government workers so good honest people who go to work and do their job he's accusing them of being corrupt and lazy and useless and just cutting their jobs and it's gonna be terrible it's gonna have terrible consequences on people and he just doesn't seem to care so the one thing the only time i've seen him care was when i criticized him and he said i was cruel"
    },
    "spoken_word_count": {
      "confidence": 1.0,
      "evidence_type": "deterministic_derivation",
      "method": "compiler_tokenizer_v1",
      "sources": [
        {
          "path": "$.transcript.full_text"
        }
      ],
      "value": 166
    },
    "subtopic": {
      "evidence_type": "unknown",
      "reason": "subtopic is not provided by the extractor",
      "sources": [],
      "value": null
    },
    "topic": {
      "evidence_type": "unknown",
      "reason": "topic is not provided by the extractor and local keyword inference is disabled",
      "sources": [],
      "value": null
    },
    "video_duration_seconds": {
      "evidence_type": "observed",
      "sources": [
        {
          "path": "$.source.duration_seconds"
        }
      ],
      "value": 59.118
    },
    "words_per_second": {
      "confidence": 1.0,
      "evidence_type": "deterministic_derivation",
      "method": "word_count_divided_by_video_duration",
      "sources": [
        {
          "path": "$.transcript.full_text"
        },
        {
          "path": "$.source.duration_seconds"
        }
      ],
      "value": 2.8079
    }
  },
  "delivery": {
    "emphasis_candidates": {
      "confidence": 0.69,
      "evidence_type": "heuristic_inference",
      "method": "upstream_pitch_energy_duration_candidates",
      "sources": [
        {
          "path": "$.transcript.emphasized_words"
        }
      ],
      "value": [
        {
          "confidence": 0.841,
          "duration_seconds": 0.18,
          "end": 1.74,
          "energy_above_local_words_db": 3.01,
          "evidence": [
            "high_local_energy",
            "duration_lengthening"
          ],
          "is_stopword": false,
          "pitch_f0_hz": 106.7,
          "start": 1.56,
          "verification_status": "candidate",
          "word": "world,"
        },
        {
          "confidence": 0.9,
          "duration_seconds": 0.1,
          "end": 23.98,
          "energy_above_local_words_db": 6.82,
          "evidence": [
            "high_local_energy"
          ],
          "is_stopword": false,
          "pitch_f0_hz": 140.4,
          "start": 23.88,
          "verification_status": "candidate",
          "word": "he's"
        },
        {
          "confidence": 0.9,
          "duration_seconds": 0.08,
          "end": 50.36,
          "energy_above_local_words_db": 6.21,
          "evidence": [
            "high_local_energy",
            "pitch_f0_elevation"
          ],
          "is_stopword": true,
          "pitch_f0_hz": 152.4,
          "start": 50.28,
          "verification_status": "candidate",
          "word": "And"
        },
        {
          "confidence": 0.812,
          "duration_seconds": 0.14,
          "end": 54.22,
          "energy_above_local_words_db": 4.84,
          "evidence": [
            "high_local_energy"
          ],
          "is_stopword": false,
          "pitch_f0_hz": 192.8,
          "start": 54.08,
          "verification_status": "candidate",
          "word": "only"
        },
        {
          "confidence": 0.781,
          "duration_seconds": 0.12,
          "end": 54.9,
          "energy_above_local_words_db": 4.22,
          "evidence": [
            "high_local_energy"
          ],
          "is_stopword": false,
          "pitch_f0_hz": 140.4,
          "start": 54.78,
          "verification_status": "candidate",
          "word": "him"
        },
        {
          "confidence": 0.69,
          "duration_seconds": 0.26,
          "end": 56.38,
          "energy_above_local_words_db": 0.0,
          "evidence": [
            "pitch_f0_elevation",
            "duration_lengthening"
          ],
          "is_stopword": false,
          "pitch_f0_hz": 179.8,
          "start": 56.12,
          "verification_status": "candidate",
          "word": "criticized"
        }
      ]
    },
    "energy_changes": {
      "evidence_type": "unknown",
      "reason": "extractor provides word-level energy but no validated section-level energy-change events",
      "sources": [],
      "value": null
    },
    "pace_transitions": [
      {
        "at_seconds": 4.0,
        "direction": "slower",
        "evidence": {
          "confidence": 1.0,
          "evidence_type": "deterministic_derivation",
          "method": "adjacent_rolling_window_delta_at_least_60_wpm",
          "sources": [
            {
              "end_seconds": 8.0,
              "path": "$.transcript.delivery.rolling_windows",
              "start_seconds": 4.0
            }
          ],
          "value": true
        },
        "from_wpm": 270.0,
        "to_wpm": 195.0
      },
      {
        "at_seconds": 6.0,
        "direction": "slower",
        "evidence": {
          "confidence": 1.0,
          "evidence_type": "deterministic_derivation",
          "method": "adjacent_rolling_window_delta_at_least_60_wpm",
          "sources": [
            {
              "end_seconds": 10.0,
              "path": "$.transcript.delivery.rolling_windows",
              "start_seconds": 6.0
            }
          ],
          "value": true
        },
        "from_wpm": 195.0,
        "to_wpm": 135.0
      },
      {
        "at_seconds": 8.0,
        "direction": "faster",
        "evidence": {
          "confidence": 1.0,
          "evidence_type": "deterministic_derivation",
          "method": "adjacent_rolling_window_delta_at_least_60_wpm",
          "sources": [
            {
              "end_seconds": 12.0,
              "path": "$.transcript.delivery.rolling_windows",
              "start_seconds": 8.0
            }
          ],
          "value": true
        },
        "from_wpm": 135.0,
        "to_wpm": 195.0
      },
      {
        "at_seconds": 12.0,
        "direction": "slower",
        "evidence": {
          "confidence": 1.0,
          "evidence_type": "deterministic_derivation",
          "method": "adjacent_rolling_window_delta_at_least_60_wpm",
          "sources": [
            {
              "end_seconds": 16.0,
              "path": "$.transcript.delivery.rolling_windows",
              "start_seconds": 12.0
            }
          ],
          "value": true
        },
        "from_wpm": 180.0,
        "to_wpm": 105.0
      },
      {
        "at_seconds": 36.0,
        "direction": "faster",
        "evidence": {
          "confidence": 1.0,
          "evidence_type": "deterministic_derivation",
          "method": "adjacent_rolling_window_delta_at_least_60_wpm",
          "sources": [
            {
              "end_seconds": 40.0,
              "path": "$.transcript.delivery.rolling_windows",
              "start_seconds": 36.0
            }
          ],
          "value": true
        },
        "from_wpm": 105.0,
        "to_wpm": 165.0
      },
      {
        "at_seconds": 38.0,